original_text,cleaned_text,case_folding,tokenized_text,normalized_text,stopword_removed,token_to_text,no_topic,label_aspek,sentimen,,,,Jumlah,Positif,Negatif,
"Sudah bagus lebih kreatif dengan susunan acara		",Sudah bagus lebih kreatif dengan susunan acara,sudah bagus lebih kreatif dengan susunan acara,"['sudah', 'bagus', 'lebih', 'kreatif', 'dengan', 'susunan', 'acara']","['sudah', 'keren', 'lebih', 'inovatif', 'dengan', 'susunan', 'acara']","['keren', 'inovatif', 'susunan', 'acara']",keren inovatif susunan acara,1,Kesuksesan Acara,Positif,,,,,,,
"saran saya agar acara seperti ini diadakan lagi untuk selanjutnya.		",saran saya agar acara seperti ini diadakan lagi untuk selanjutnya,saran saya agar acara seperti ini diadakan lagi untuk selanjutnya,"['saran', 'saya', 'agar', 'acara', 'seperti', 'ini', 'diadakan', 'lagi', 'untuk', 'selanjutnya']","['usulan', 'saya', 'agar', 'acara', 'seperti', 'ini', 'mengadakan', 'lagi', 'untuk', 'lanjut']","['usulan', 'acara', 'mengadakan', 'lanjut']",usulan acara mengadakan lanjut,3,Harapan Acara,Positif,,,,,,,
"Acara sudah sangat baik		",Acara sudah sangat baik,acara sudah sangat baik,"['acara', 'sudah', 'sangat', 'baik']","['acara', 'sudah', 'sangat', 'baik']","['acara', 'baik']",acara baik,1,Kesuksesan Acara,Positif,,,,,,,
"Kuis yang diberikan sangat interaktif dan menarik melalui quizziz		",Kuis yang diberikan sangat interaktif dan menarik melalui quizziz,kuis yang diberikan sangat interaktif dan menarik melalui quizziz,"['kuis', 'yang', 'diberikan', 'sangat', 'interaktif', 'dan', 'menarik', 'melalui', 'quizziz']","['kuis', 'yang', 'diberikan', 'sangat', 'interaksi', 'dan', 'seru', 'melalui', 'kuis']","['kuis', 'diberikan', 'interaksi', 'seru', 'melalui', 'kuis']",kuis diberikan interaksi seru melalui kuis,5,Teknis dan Jaringan,Positif,,,,,,,
"namun ada baiknya jika soal atau jawaban yang diberikan lebih jelas dan terstruktur demi kebenaran dari jawaban yang diberikan		",namun ada baiknya jika soal atau jawaban yang diberikan lebih jelas dan terstruktur demi kebenaran dari jawaban yang diberikan,namun ada baiknya jika soal atau jawaban yang diberikan lebih jelas dan terstruktur demi kebenaran dari jawaban yang diberikan,"['namun', 'ada', 'baiknya', 'jika', 'soal', 'atau', 'jawaban', 'yang', 'diberikan', 'lebih', 'jelas', 'dan', 'terstruktur', 'demi', 'kebenaran', 'dari', 'jawaban', 'yang', 'diberikan']","['namun', 'ada', 'sebaiknya', 'jika', 'soal', 'atau', 'jawaban', 'yang', 'diberikan', 'lebih', 'jelas', 'dan', 'terstruktur', 'demi', 'benar', 'dari', 'jawaban', 'yang', 'diberikan']","['sebaiknya', 'soal', 'jawaban', 'diberikan', 'jelas', 'terstruktur', 'benar', 'jawaban', 'diberikan']",sebaiknya soal jawaban diberikan jelas terstruktur benar jawaban diberikan,7,Manfaat dan Evaluasi,Negatif,,,,,,,
"Kurang lama durasinya		",Kurang lama durasinya,kurang lama durasinya,"['kurang', 'lama', 'durasinya']","['kurang', 'lama', 'durasi']","['lama', 'durasi']",lama durasi,6,Waktu dan Pelaksanaan Acara,Negatif,,,,,,,
"Sangat bermanfaat bagi kaum awam, terimakasih semoga ada webinar lagi		",Sangat bermanfaat bagi kaum awam terimakasih semoga ada webinar lagi,sangat bermanfaat bagi kaum awam terimakasih semoga ada webinar lagi,"['sangat', 'bermanfaat', 'bagi', 'kaum', 'awam', 'terimakasih', 'semoga', 'ada', 'webinar', 'lagi']","['sangat', 'bermanfaat', 'bagi', 'kaum', 'awam', 'terima kasih', 'semoga', 'ada', 'seminar', 'lagi']","['bermanfaat', 'kaum', 'awam', 'terima kasih', 'semoga', 'seminar']",bermanfaat kaum awam terima kasih semoga seminar,7,Manfaat dan Evaluasi,Positif,,,,,,,
"Sambutannya terlalu lama		",Sambutannya terlalu lama,sambutannya terlalu lama,"['sambutannya', 'terlalu', 'lama']","['sambutan', 'terlalu', 'lama']","['sambutan', 'terlalu', 'lama']",sambutan terlalu lama,6,Waktu dan Pelaksanaan Acara,Positif,,,,,,,
"jangan week days dong kak		",jangan week days dong kak,jangan week days dong kak,"['jangan', 'week', 'days', 'dong', 'kak']","['jangan', 'minggu', 'hari', 'dong', 'kakak']","['jangan', 'minggu', 'hari', 'dong', 'kakak']",jangan minggu hari dong kakak,6,Waktu dan Pelaksanaan Acara,Negatif,,,,,,,
"Bagus terus tingkatkan		",Bagus terus tingkatkan,bagus terus tingkatkan,"['bagus', 'terus', 'tingkatkan']","['keren', 'terus', 'tingkatkan']","['keren', 'terus', 'tingkatkan']",keren terus tingkatkan,1,Kesuksesan Acara,Positif,,,,,,,
"Acaranya sangat keren		",Acaranya sangat keren,acaranya sangat keren,"['acaranya', 'sangat', 'keren']","['acara', 'sangat', 'keren']","['acara', 'keren']",acara keren,1,Kesuksesan Acara,Positif,,,,,,,
"materinya sangat bermanfaat		",materinya sangat bermanfaat,materinya sangat bermanfaat,"['materinya', 'sangat', 'bermanfaat']","['materi', 'sangat', 'bermanfaat']","['materi', 'bermanfaat']",materi bermanfaat,2,Materi dan Narasumber,Positif,,,,,,,
"penjelasannya jelas dan bagus, semua pertanyaan dijawab dengan pintar dan jelas		",penjelasannya jelas dan bagus semua pertanyaan dijawab dengan pintar dan jelas,penjelasannya jelas dan bagus semua pertanyaan dijawab dengan pintar dan jelas,"['penjelasannya', 'jelas', 'dan', 'bagus', 'semua', 'pertanyaan', 'dijawab', 'dengan', 'pintar', 'dan', 'jelas']","['penyampaian', 'jelas', 'dan', 'keren', 'semua', 'pertanyaan', 'jawab', 'dengan', 'pintar', 'dan', 'jelas']","['penyampaian', 'jelas', 'keren', 'pertanyaan', 'jawab', 'pintar', 'jelas']",penyampaian jelas keren pertanyaan jawab pintar jelas,2,Materi dan Narasumber,Positif,,,,,,,
"sukses terus panitia penyelenggara		",sukses terus panitia penyelenggara,sukses terus panitia penyelenggara,"['sukses', 'terus', 'panitia', 'penyelenggara']","['sukses', 'terus', 'penyelenggara', 'penyelenggara']","['sukses', 'terus', 'penyelenggara', 'penyelenggara']",sukses terus penyelenggara penyelenggara,1,Kesuksesan Acara,Positif,,,,,,,
"banyakin games nya		",banyakin games nya,banyakin games nya,"['banyakin', 'games', 'nya']","['banyak', 'permainan', 'nya']","['banyak', 'permainan']",banyak permainan,6,Waktu dan Pelaksanaan Acara,Negatif,,,,,,,
"banyakin quiz nya		",banyakin quiz nya,banyakin quiz nya,"['banyakin', 'quiz', 'nya']","['banyak', 'kuis', 'nya']","['banyak', 'kuis']",banyak kuis,5,Teknis dan Jaringan,Negatif,,,,,,,
"festival nya sudah sangat bagus menurut saya		",festival nya sudah sangat bagus menurut saya,festival nya sudah sangat bagus menurut saya,"['festival', 'nya', 'sudah', 'sangat', 'bagus', 'menurut', 'saya']","['fkbmik', 'nya', 'sudah', 'sangat', 'keren', 'menurut', 'saya']","['fkbmik', 'keren']",fkbmik keren,1,Kesuksesan Acara,Positif,,,,,,,
"sudah sangat baik karena penyampaian materi sangat edukatif dan terstruktur		",sudah sangat baik karena penyampaian materi sangat edukatif dan terstruktur,sudah sangat baik karena penyampaian materi sangat edukatif dan terstruktur,"['sudah', 'sangat', 'baik', 'karena', 'penyampaian', 'materi', 'sangat', 'edukatif', 'dan', 'terstruktur']","['sudah', 'sangat', 'baik', 'karena', 'penyampaian', 'materi', 'sangat', 'pelajaran', 'dan', 'terstruktur']","['baik', 'penyampaian', 'materi', 'pelajaran', 'terstruktur']",baik penyampaian materi pelajaran terstruktur,2,Materi dan Narasumber,Positif,,,,,,,
"sudah bagus dan berjalan lancar acaranya kak		",sudah bagus dan berjalan lancar acaranya kak,sudah bagus dan berjalan lancar acaranya kak,"['sudah', 'bagus', 'dan', 'berjalan', 'lancar', 'acaranya', 'kak']","['sudah', 'keren', 'dan', 'terlaksana', 'sukses', 'acara', 'kakak']","['keren', 'terlaksana', 'sukses', 'acara', 'kakak']",keren terlaksana sukses acara kakak,1,Kesuksesan Acara,Positif,,,,,,,
"dibuat lebih seru lagi karena tadi bosenin		",dibuat lebih seru lagi karena tadi bosenin,dibuat lebih seru lagi karena tadi bosenin,"['dibuat', 'lebih', 'seru', 'lagi', 'karena', 'tadi', 'bosenin']","['dibuat', 'lebih', 'seru', 'lagi', 'karena', 'tadi', 'bosan']","['dibuat', 'seru', 'tadi', 'bosan']",dibuat seru tadi bosan,7,Manfaat dan Evaluasi,Negatif,,,,,,,
"Terima kasih sudah mengadakan acara FKBM ini, semoga tahun-tahun selanjutnya bisa lebih seru dan lebih meriah lagi.		",Terima kasih sudah mengadakan acara FKBM ini semoga tahuntahun selanjutnya bisa lebih seru dan lebih meriah lagi,terima kasih sudah mengadakan acara fkbm ini semoga tahuntahun selanjutnya bisa lebih seru dan lebih meriah lagi,"['terima', 'kasih', 'sudah', 'mengadakan', 'acara', 'fkbm', 'ini', 'semoga', 'tahuntahun', 'selanjutnya', 'bisa', 'lebih', 'seru', 'dan', 'lebih', 'meriah', 'lagi']","['terima', 'kasih', 'sudah', 'mengadakan', 'acara', 'fkbmik', 'ini', 'semoga', 'waktu', 'lanjut', 'bisa', 'lebih', 'seru', 'dan', 'lebih', 'meriah', 'lagi']","['terima', 'kasih', 'mengadakan', 'acara', 'fkbmik', 'semoga', 'waktu', 'lanjut', 'seru', 'meriah']",terima kasih mengadakan acara fkbmik semoga waktu lanjut seru meriah,3,Harapan Acara,Positif,,,,,,,
"Acaranya cukup menyenangkan		",Acaranya cukup menyenangkan,acaranya cukup menyenangkan,"['acaranya', 'cukup', 'menyenangkan']","['acara', 'cukup', 'senang']","['acara', 'cukup', 'senang']",acara cukup senang,1,Kesuksesan Acara,Positif,,,,,,,
"gaada, acaranya kerennn		",gaada acaranya keren,gaada acaranya keren,"['gaada', 'acaranya', 'keren']","['tidak ada', 'acara', 'keren']","['acara', 'keren']",acara keren,1,Kesuksesan Acara,Positif,,,,,,,
"webinar ini sangat informatif dan bermanfaat, semoga tahun depan bisa join kembali webinar FKBMIK		",webinar ini sangat informatif dan bermanfaat semoga tahun depan bisa join kembali webinar FKBMIK,webinar ini sangat informatif dan bermanfaat semoga tahun depan bisa join kembali webinar fkbmik,"['webinar', 'ini', 'sangat', 'informatif', 'dan', 'bermanfaat', 'semoga', 'tahun', 'depan', 'bisa', 'join', 'kembali', 'webinar', 'fkbmik']","['seminar', 'ini', 'sangat', 'informatif', 'dan', 'bermanfaat', 'semoga', 'waktu', 'depan', 'bisa', 'gabung', 'kembali', 'seminar', 'fkbmik']","['seminar', 'informatif', 'bermanfaat', 'semoga', 'waktu', 'depan', 'gabung', 'seminar', 'fkbmik']",seminar informatif bermanfaat semoga waktu depan gabung seminar fkbmik,7,Manfaat dan Evaluasi,Positif,,,,,,,
"kalau bisa diadakan secara offline di UPNVJATIM.		",kalau bisa diadakan secara offline di UPNVJATIM,kalau bisa diadakan secara offline di upnvjatim,"['kalau', 'bisa', 'diadakan', 'secara', 'offline', 'di', 'upnvjatim']","['kalau', 'bisa', 'mengadakan', 'secara', 'luring', 'di', 'upnvjt']","['mengadakan', 'luring', 'upnvjt']",mengadakan luring upnvjt,3,Harapan Acara,Negatif,,,,,,,
"mantap sekali panitia		",mantap sekali panitia,mantap sekali panitia,"['mantap', 'sekali', 'panitia']","['baik', 'sekali', 'penyelenggara']","['baik', 'sekali', 'penyelenggara']",baik sekali penyelenggara,1,Kesuksesan Acara,Positif,,,,,,,
"Sering-sering adain event kaya gini ya		",Seringsering adain event kaya gini ya,seringsering adain event kaya gini ya,"['seringsering', 'adain', 'event', 'kaya', 'gini', 'ya']","['sering', 'mengadakan', 'acara', 'kaya', 'begini', 'ya']","['sering', 'mengadakan', 'acara', 'kaya', 'begini']",sering mengadakan acara kaya begini,4,Antusiasme Peserta,Positif,,,,,,,
"dibandingkan webinar tahun kemarin webinar kali ini jauh lebih seru		",dibandingkan webinar tahun kemarin webinar kali ini jauh lebih seru,dibandingkan webinar tahun kemarin webinar kali ini jauh lebih seru,"['dibandingkan', 'webinar', 'tahun', 'kemarin', 'webinar', 'kali', 'ini', 'jauh', 'lebih', 'seru']","['dibandingkan', 'seminar', 'waktu', 'kemarin', 'seminar', 'kali', 'ini', 'jauh', 'lebih', 'seru']","['dibandingkan', 'seminar', 'waktu', 'kemarin', 'seminar', 'kali', 'jauh', 'seru']",dibandingkan seminar waktu kemarin seminar kali jauh seru,2,Materi dan Narasumber,Positif,,,,,,,
"materi yang diberikan juga update bgt tentang masalah terkini.		",materi yang diberikan juga update bgt tentang masalah terkini,materi yang diberikan juga update bgt tentang masalah terkini,"['materi', 'yang', 'diberikan', 'juga', 'update', 'bgt', 'tentang', 'masalah', 'terkini']","['materi', 'yang', 'diberikan', 'juga', 'inovasi', 'banget', 'tentang', 'kendala', 'terkini']","['materi', 'diberikan', 'inovasi', 'banget', 'kendala', 'terkini']",materi diberikan inovasi banget kendala terkini,2,Materi dan Narasumber,Positif,,,,,,,
"untuk kedepannya semoga acaranya lebih tepat waktu lagi sesuai jadwal		",untuk kedepannya semoga acaranya lebih tepat waktu lagi sesuai jadwal,untuk kedepannya semoga acaranya lebih tepat waktu lagi sesuai jadwal,"['untuk', 'kedepannya', 'semoga', 'acaranya', 'lebih', 'tepat', 'waktu', 'lagi', 'sesuai', 'jadwal']","['untuk', 'ke depannya', 'semoga', 'acara', 'lebih', 'tepat', 'waktu', 'lagi', 'sesuai', 'jadwal']","['ke depannya', 'semoga', 'acara', 'tepat', 'waktu', 'sesuai', 'jadwal']",ke depannya semoga acara tepat waktu sesuai jadwal,6,Waktu dan Pelaksanaan Acara,Negatif,,,,,,,
"tetapi saran saya perlu ditambahkannya sedikit animasi animasi agar tidak membosankan.		",tetapi saran saya perlu ditambahkannya sedikit animasi animasi agar tidak membosankan,tetapi saran saya perlu ditambahkannya sedikit animasi animasi agar tidak membosankan,"['tetapi', 'saran', 'saya', 'perlu', 'ditambahkannya', 'sedikit', 'animasi', 'animasi', 'agar', 'tidak', 'membosankan']","['tetapi', 'usulan', 'saya', 'perlu', 'tambah', 'sedikit', 'konten', 'konten', 'agar', 'tidak', 'bosan']","['usulan', 'perlu', 'tambah', 'sedikit', 'konten', 'konten', 'bosan']",usulan perlu tambah sedikit konten konten bosan,7,Manfaat dan Evaluasi,Positif,,,,,,,
"Sangat seru acaranya dan bermanfaat		",Sangat seru acaranya dan bermanfaat,sangat seru acaranya dan bermanfaat,"['sangat', 'seru', 'acaranya', 'dan', 'bermanfaat']","['sangat', 'seru', 'acara', 'dan', 'bermanfaat']","['seru', 'acara', 'bermanfaat']",seru acara bermanfaat,7,Manfaat dan Evaluasi,Positif,,,,,,,
"Jadwal mulai nya tidak tepat waktu semoga kedepanya bisa lebih baik lagi		",Jadwal mulai nya tidak tepat waktu semoga kedepanya bisa lebih baik lagi,jadwal mulai nya tidak tepat waktu semoga kedepanya bisa lebih baik lagi,"['jadwal', 'mulai', 'nya', 'tidak', 'tepat', 'waktu', 'semoga', 'kedepanya', 'bisa', 'lebih', 'baik', 'lagi']","['jadwal', 'mulai', 'nya', 'tidak', 'tepat', 'waktu', 'semoga', 'ke depannya', 'bisa', 'lebih', 'baik', 'lagi']","['jadwal', 'mulai', 'tepat', 'waktu', 'semoga', 'ke depannya', 'baik']",jadwal mulai tepat waktu semoga ke depannya baik,6,Waktu dan Pelaksanaan Acara,Negatif,,,,,,,
"Kakak kakak narasumber nya keren		",Kakak kakak narasumber nya keren,kakak kakak narasumber nya keren,"['kakak', 'kakak', 'narasumber', 'nya', 'keren']","['kakak', 'kakak', 'narasumber', 'nya', 'keren']","['kakak', 'kakak', 'narasumber', 'keren']",kakak kakak narasumber keren,2,Materi dan Narasumber,Positif,,,,,,,
"Acara berjalan dengan baik tanpa ada kendala		",Acara berjalan dengan baik tanpa ada kendala,acara berjalan dengan baik tanpa ada kendala,"['acara', 'berjalan', 'dengan', 'baik', 'tanpa', 'ada', 'kendala']","['acara', 'terlaksana', 'dengan', 'baik', 'tanpa', 'ada', 'kendala']","['acara', 'terlaksana', 'baik', 'kendala']",acara terlaksana baik kendala,1,Kesuksesan Acara,Positif,,,,,,,
"Seruuuu walaupun gk bisa pake vbg sorry ya kak		",Seru walaupun gk bisa pake vbg sorry ya kak,seru walaupun gk bisa pake vbg sorry ya kak,"['seru', 'walaupun', 'gk', 'bisa', 'pake', 'vbg', 'sorry', 'ya', 'kak']","['seru', 'walaupun', 'tidak', 'bisa', 'pakai', 'vbg', 'maaf', 'ya', 'kakak']","['seru', 'walaupun', 'pakai', 'vbg', 'maaf', 'kakak']",seru walaupun pakai vbg maaf kakak,1,Kesuksesan Acara,Positif,,,,,,,
"Semoga fkbmik diadakan lagi tahun depan		",Semoga fkbmik diadakan lagi tahun depan,semoga fkbmik diadakan lagi tahun depan,"['semoga', 'fkbmik', 'diadakan', 'lagi', 'tahun', 'depan']","['semoga', 'fkbmik', 'mengadakan', 'lagi', 'waktu', 'depan']","['semoga', 'fkbmik', 'mengadakan', 'waktu', 'depan']",semoga fkbmik mengadakan waktu depan,3,Harapan Acara,Positif,,,,,,,
"ada quiz dan pantun"" yang seru dan tidak membosankan		",ada quiz dan pantun yang seru dan tidak membosankan,ada quiz dan pantun yang seru dan tidak membosankan,"['ada', 'quiz', 'dan', 'pantun', 'yang', 'seru', 'dan', 'tidak', 'membosankan']","['ada', 'kuis', 'dan', 'pantun', 'yang', 'seru', 'dan', 'tidak', 'bosan']","['kuis', 'pantun', 'seru', 'bosan']",kuis pantun seru bosan,4,Antusiasme Peserta,Positif,,,,,,,
"Acaranya menarik karena narasumbernya bisa membawakan materi dengan baik dan asik.		",Acaranya menarik karena narasumbernya bisa membawakan materi dengan baik dan asik,acaranya menarik karena narasumbernya bisa membawakan materi dengan baik dan asik,"['acaranya', 'menarik', 'karena', 'narasumbernya', 'bisa', 'membawakan', 'materi', 'dengan', 'baik', 'dan', 'asik']","['acara', 'seru', 'karena', 'narasumber', 'bisa', 'membawa', 'materi', 'dengan', 'baik', 'dan', 'asyik']","['acara', 'seru', 'narasumber', 'membawa', 'materi', 'baik', 'asyik']",acara seru narasumber membawa materi baik asyik,2,Materi dan Narasumber,Positif,,,,,,,
"MC dan moderatornya juga oke banget jadi tidak terlalu boring ketika webinar berlangsung		",MC dan moderatornya juga oke banget jadi tidak terlalu boring ketika webinar berlangsung,mc dan moderatornya juga oke banget jadi tidak terlalu boring ketika webinar berlangsung,"['mc', 'dan', 'moderatornya', 'juga', 'oke', 'banget', 'jadi', 'tidak', 'terlalu', 'boring', 'ketika', 'webinar', 'berlangsung']","['mc', 'dan', 'moderator', 'juga', 'baik', 'sekali', 'jadi', 'tidak', 'terlalu', 'bosan', 'ketika', 'seminar', 'dilaksanakan']","['mc', 'moderator', 'baik', 'sekali', 'terlalu', 'bosan', 'seminar', 'dilaksanakan']",mc moderator baik sekali terlalu bosan seminar dilaksanakan,6,Waktu dan Pelaksanaan Acara,Positif,,,,,,,
"pemaparan materi yang jelas.		",pemaparan materi yang jelas,pemaparan materi yang jelas,"['pemaparan', 'materi', 'yang', 'jelas']","['pemaparan', 'materi', 'yang', 'jelas']","['pemaparan', 'materi', 'jelas']",pemaparan materi jelas,2,Materi dan Narasumber,Positif,,,,,,,
"alhamdulillah lancar, semoga selanjutnya offline		",alhamdulillah lancar semoga selanjutnya offline,alhamdulillah lancar semoga selanjutnya offline,"['alhamdulillah', 'lancar', 'semoga', 'selanjutnya', 'offline']","['syukur', 'sukses', 'semoga', 'lanjut', 'luring']","['syukur', 'sukses', 'semoga', 'lanjut', 'luring']",syukur sukses semoga lanjut luring,3,Harapan Acara,Positif,,,,,,,
"Terimakasih sudah menyelenggarakan acara yang sangat luar biasa dan bermanfaat		",Terimakasih sudah menyelenggarakan acara yang sangat luar biasa dan bermanfaat,terimakasih sudah menyelenggarakan acara yang sangat luar biasa dan bermanfaat,"['terimakasih', 'sudah', 'menyelenggarakan', 'acara', 'yang', 'sangat', 'luar', 'biasa', 'dan', 'bermanfaat']","['terima kasih', 'sudah', 'menyelenggarakan', 'acara', 'yang', 'sangat', 'luar', 'biasa', 'dan', 'bermanfaat']","['terima kasih', 'menyelenggarakan', 'acara', 'luar', 'biasa', 'bermanfaat']",terima kasih menyelenggarakan acara luar biasa bermanfaat,7,Manfaat dan Evaluasi,Positif,,,,,,,
"sudah cukup bagus dan menarik		",sudah cukup bagus dan menarik,sudah cukup bagus dan menarik,"['sudah', 'cukup', 'bagus', 'dan', 'menarik']","['sudah', 'cukup', 'keren', 'dan', 'seru']","['cukup', 'keren', 'seru']",cukup keren seru,1,Kesuksesan Acara,Positif,,,,,,,
"Webinarnya seru, coba undang guest banyak lagi		",Webinarnya seru coba undang guest banyak lagi,webinarnya seru coba undang guest banyak lagi,"['webinarnya', 'seru', 'coba', 'undang', 'guest', 'banyak', 'lagi']","['seminar', 'seru', 'coba', 'undang', 'narasumber', 'banyak', 'lagi']","['seminar', 'seru', 'coba', 'undang', 'narasumber', 'banyak']",seminar seru coba undang narasumber banyak,2,Materi dan Narasumber,Positif,,,,,,,
"Semoga lain waktu acaranya secara luring		",Semoga lain waktu acaranya secara luring,semoga lain waktu acaranya secara luring,"['semoga', 'lain', 'waktu', 'acaranya', 'secara', 'luring']","['semoga', 'lain', 'waktu', 'acara', 'secara', 'luring']","['semoga', 'waktu', 'acara', 'luring']",semoga waktu acara luring,3,Harapan Acara,Positif,,,,,,,
"ada sedikit suara suara aja yang mengganggu		",ada sedikit suara suara aja yang mengganggu,ada sedikit suara suara aja yang mengganggu,"['ada', 'sedikit', 'suara', 'suara', 'aja', 'yang', 'mengganggu']","['ada', 'sedikit', 'suara', 'suara', 'saja', 'yang', 'gangguan']","['sedikit', 'suara', 'suara', 'gangguan']",sedikit suara suara gangguan,5,Teknis dan Jaringan,Negatif,,,,,,,
"sangat menarik dan memberikan banyak ilmu yang dapat diambil juga sangat bermanfaat		",sangat menarik dan memberikan banyak ilmu yang dapat diambil juga sangat bermanfaat,sangat menarik dan memberikan banyak ilmu yang dapat diambil juga sangat bermanfaat,"['sangat', 'menarik', 'dan', 'memberikan', 'banyak', 'ilmu', 'yang', 'dapat', 'diambil', 'juga', 'sangat', 'bermanfaat']","['sangat', 'seru', 'dan', 'memberi', 'banyak', 'pengalaman', 'yang', 'dapat', 'ambil', 'juga', 'sangat', 'bermanfaat']","['seru', 'memberi', 'banyak', 'pengalaman', 'ambil', 'bermanfaat']",seru memberi banyak pengalaman ambil bermanfaat,7,Manfaat dan Evaluasi,Positif,,,,,,,
"mungkin bisa diselingi games atau hiburan agar peserta tidak bosan		",mungkin bisa diselingi games atau hiburan agar peserta tidak bosan,mungkin bisa diselingi games atau hiburan agar peserta tidak bosan,"['mungkin', 'bisa', 'diselingi', 'games', 'atau', 'hiburan', 'agar', 'peserta', 'tidak', 'bosan']","['mungkin', 'bisa', 'selingan', 'permainan', 'atau', 'hiburan', 'agar', 'peserta', 'tidak', 'bosan']","['mungkin', 'selingan', 'permainan', 'hiburan', 'peserta', 'bosan']",mungkin selingan permainan hiburan peserta bosan,6,Waktu dan Pelaksanaan Acara,Negatif,,,,,,,
"FKBM-IK keren		",FKBMIK keren,fkbmik keren,"['fkbmik', 'keren']","['fkbmik', 'keren']","['fkbmik', 'keren']",fkbmik keren,1,Kesuksesan Acara,Positif,,,,,,,
"acaranya seru dan bermanfaat		",acaranya seru dan bermanfaat,acaranya seru dan bermanfaat,"['acaranya', 'seru', 'dan', 'bermanfaat']","['acara', 'seru', 'dan', 'bermanfaat']","['acara', 'seru', 'bermanfaat']",acara seru bermanfaat,7,Manfaat dan Evaluasi,Positif,,,,,,,
"Acaranya dan pembicaranya seru apalagi ada games semoga next ada acara kaya gini lagi yaa		",Acaranya dan pembicaranya seru apalagi ada games semoga next ada acara kaya gini lagi yaa,acaranya dan pembicaranya seru apalagi ada games semoga next ada acara kaya gini lagi yaa,"['acaranya', 'dan', 'pembicaranya', 'seru', 'apalagi', 'ada', 'games', 'semoga', 'next', 'ada', 'acara', 'kaya', 'gini', 'lagi', 'yaa']","['acara', 'dan', 'narasumber', 'seru', 'apalagi', 'ada', 'permainan', 'semoga', 'lanjut', 'ada', 'acara', 'kaya', 'begini', 'lagi', 'iya']","['acara', 'narasumber', 'seru', 'permainan', 'semoga', 'lanjut', 'acara', 'kaya', 'begini']",acara narasumber seru permainan semoga lanjut acara kaya begini,2,Materi dan Narasumber,Positif,,,,,,,
"semoga tahun depan bisa offline		",semoga tahun depan bisa offline,semoga tahun depan bisa offline,"['semoga', 'tahun', 'depan', 'bisa', 'offline']","['semoga', 'waktu', 'depan', 'bisa', 'luring']","['semoga', 'waktu', 'depan', 'luring']",semoga waktu depan luring,3,Harapan Acara,Positif,,,,,,,
"Sudah bagus, sukses selalu		",Sudah bagus sukses selalu,sudah bagus sukses selalu,"['sudah', 'bagus', 'sukses', 'selalu']","['sudah', 'keren', 'sukses', 'selalu']","['keren', 'sukses', 'selalu']",keren sukses selalu,1,Kesuksesan Acara,Positif,,,,,,,
"Waktu mungkin dimulai nya bisa lebih tepat waktu		",Waktu mungkin dimulai nya bisa lebih tepat waktu,waktu mungkin dimulai nya bisa lebih tepat waktu,"['waktu', 'mungkin', 'dimulai', 'nya', 'bisa', 'lebih', 'tepat', 'waktu']","['waktu', 'mungkin', 'mulai', 'nya', 'bisa', 'lebih', 'tepat', 'waktu']","['waktu', 'mungkin', 'mulai', 'tepat', 'waktu']",waktu mungkin mulai tepat waktu,6,Waktu dan Pelaksanaan Acara,Negatif,,,,,,,
"kedepannya diharapkan waktu mulai sesuai dengan apa yang disampaikan		",kedepannya diharapkan waktu mulai sesuai dengan apa yang disampaikan,kedepannya diharapkan waktu mulai sesuai dengan apa yang disampaikan,"['kedepannya', 'diharapkan', 'waktu', 'mulai', 'sesuai', 'dengan', 'apa', 'yang', 'disampaikan']","['ke depannya', 'diharapkan', 'waktu', 'mulai', 'sesuai', 'dengan', 'apa', 'yang', 'disampaikan']","['ke depannya', 'diharapkan', 'waktu', 'mulai', 'sesuai', 'apa', 'disampaikan']",ke depannya diharapkan waktu mulai sesuai apa disampaikan,6,Waktu dan Pelaksanaan Acara,Negatif,,,,,,,
"mulainya lumayan lama dari jam yang ditentukan		",mulainya lumayan lama dari jam yang ditentukan,mulainya lumayan lama dari jam yang ditentukan,"['mulainya', 'lumayan', 'lama', 'dari', 'jam', 'yang', 'ditentukan']","['mulai', 'lumayan', 'lama', 'dari', 'waktu', 'yang', 'ditentukan']","['mulai', 'lumayan', 'lama', 'waktu', 'ditentukan']",mulai lumayan lama waktu ditentukan,6,Waktu dan Pelaksanaan Acara,Negatif,,,,,,,
"Acara berjalan dengan baik dan lancar		",Acara berjalan dengan baik dan lancar,acara berjalan dengan baik dan lancar,"['acara', 'berjalan', 'dengan', 'baik', 'dan', 'lancar']","['acara', 'terlaksana', 'dengan', 'baik', 'dan', 'sukses']","['acara', 'terlaksana', 'baik', 'sukses']",acara terlaksana baik sukses,1,Kesuksesan Acara,Positif,,,,,,,
"Materi nya tolong di share kak		",Materi nya tolong di share kak,materi nya tolong di share kak,"['materi', 'nya', 'tolong', 'di', 'share', 'kak']","['materi', 'nya', 'tolong', 'di', 'berbagi', 'kakak']","['materi', 'berbagi', 'kakak']",materi berbagi kakak,2,Materi dan Narasumber,Positif,,,,,,,
"the best lah pokoknya.		",the best lah pokoknya,the best lah pokoknya,"['the', 'best', 'lah', 'pokoknya']","['itu', 'baik', 'lah', 'pokoknya']","['baik', 'pokoknya']",baik pokoknya,1,Kesuksesan Acara,Positif,,,,,,,
"Gak ada, soalnya aku dapet hadiah		",Gak ada soalnya aku dapet hadiah,gak ada soalnya aku dapet hadiah,"['gak', 'ada', 'soalnya', 'aku', 'dapet', 'hadiah']","['tidak', 'ada', 'soal', 'saya', 'dapat', 'hadiah']","['soal', 'hadiah']",soal hadiah,4,Antusiasme Peserta,Positif,,,,,,,
