original_text,cleaned_text,case_folding,tokenized_text,normalized_text,stopword_removed,token_to_text,no_topic,label_aspek,sentimen,,,,Jumlah,Positif,Negatif,
"Kegiatan sangat memotivasi, mungkin lebih ditingkat dalam segi promosi untuk umum.		",Kegiatan sangat memotivasi mungkin lebih ditingkat dalam segi promosi untuk umum,kegiatan sangat memotivasi mungkin lebih ditingkat dalam segi promosi untuk umum,"['kegiatan', 'sangat', 'memotivasi', 'mungkin', 'lebih', 'ditingkat', 'dalam', 'segi', 'promosi', 'untuk', 'umum']","['acara', 'sangat', 'inspiratif', 'mungkin', 'lebih', 'ditingkatkan', 'dalam', 'segi', 'promosi', 'untuk', 'umum']","['acara', 'inspiratif', 'mungkin', 'ditingkatkan', 'segi', 'promosi', 'umum']",acara inspiratif mungkin ditingkatkan segi promosi umum,4,Antusiasme Peserta,Positif,,,,,,,
"Kegiatan sangat menarik dan tidak membosankan		",Kegiatan sangat menarik dan tidak membosankan,kegiatan sangat menarik dan tidak membosankan,"['kegiatan', 'sangat', 'menarik', 'dan', 'tidak', 'membosankan']","['acara', 'sangat', 'seru', 'dan', 'tidak', 'bosan']","['acara', 'seru', 'bosan']",acara seru bosan,7,Manfaat dan Evaluasi,Positif,,,,,,,
"Kegiatan sangat menarik, semoga terus begini		",Kegiatan sangat menarik semoga terus begini,kegiatan sangat menarik semoga terus begini,"['kegiatan', 'sangat', 'menarik', 'semoga', 'terus', 'begini']","['acara', 'sangat', 'seru', 'semoga', 'terus', 'begini']","['acara', 'seru', 'semoga', 'terus', 'begini']",acara seru semoga terus begini,3,Harapan Acara,Positif,,,,,,,
"kegiatan sudah berjalan dengan baik		",kegiatan sudah berjalan dengan baik,kegiatan sudah berjalan dengan baik,"['kegiatan', 'sudah', 'berjalan', 'dengan', 'baik']","['acara', 'sudah', 'terlaksana', 'dengan', 'baik']","['acara', 'terlaksana', 'baik']",acara terlaksana baik,1,Kesuksesan Acara,Positif,,,,,,,
"Kegiatan sudah berjalan dengan baik dan lancar.		",Kegiatan sudah berjalan dengan baik dan lancar,kegiatan sudah berjalan dengan baik dan lancar,"['kegiatan', 'sudah', 'berjalan', 'dengan', 'baik', 'dan', 'lancar']","['acara', 'sudah', 'terlaksana', 'dengan', 'baik', 'dan', 'sukses']","['acara', 'terlaksana', 'baik', 'sukses']",acara terlaksana baik sukses,1,Kesuksesan Acara,Positif,,,,,,,
"kegiatan sudah dilaksanakan dengan baik		",kegiatan sudah dilaksanakan dengan baik,kegiatan sudah dilaksanakan dengan baik,"['kegiatan', 'sudah', 'dilaksanakan', 'dengan', 'baik']","['acara', 'sudah', 'berlangsung', 'dengan', 'baik']","['acara', 'berlangsung', 'baik']",acara berlangsung baik,1,Kesuksesan Acara,Positif,,,,,,,
"Kegiatan sudah terlaksana dengan baik		",Kegiatan sudah terlaksana dengan baik,kegiatan sudah terlaksana dengan baik,"['kegiatan', 'sudah', 'terlaksana', 'dengan', 'baik']","['acara', 'sudah', 'terlaksana', 'dengan', 'baik']","['acara', 'terlaksana', 'baik']",acara terlaksana baik,1,Kesuksesan Acara,Positif,,,,,,,
"Kegiatan sudah terlaksana dengan baik diharap kedepannya kegiatan dapat menjadi lebih baik lagi		",Kegiatan sudah terlaksana dengan baik diharap kedepannya kegiatan dapat menjadi lebih baik lagi,kegiatan sudah terlaksana dengan baik diharap kedepannya kegiatan dapat menjadi lebih baik lagi,"['kegiatan', 'sudah', 'terlaksana', 'dengan', 'baik', 'diharap', 'kedepannya', 'kegiatan', 'dapat', 'menjadi', 'lebih', 'baik', 'lagi']","['acara', 'sudah', 'terlaksana', 'dengan', 'baik', 'diharapkan', 'ke depannya', 'acara', 'dapat', 'menjadi', 'lebih', 'baik', 'lagi']","['acara', 'terlaksana', 'baik', 'diharapkan', 'ke depannya', 'acara', 'menjadi', 'baik']",acara terlaksana baik diharapkan ke depannya acara menjadi baik,1,Kesuksesan Acara,Positif,,,,,,,
"Kegiatan sudah tersusun, dan terlaksana dengan cukup baik		",Kegiatan sudah tersusun dan terlaksana dengan cukup baik,kegiatan sudah tersusun dan terlaksana dengan cukup baik,"['kegiatan', 'sudah', 'tersusun', 'dan', 'terlaksana', 'dengan', 'cukup', 'baik']","['acara', 'sudah', 'tersusun', 'dan', 'terlaksana', 'dengan', 'cukup', 'baik']","['acara', 'tersusun', 'terlaksana', 'cukup', 'baik']",acara tersusun terlaksana cukup baik,1,Kesuksesan Acara,Positif,,,,,,,
"Kegiatan telah berjalan dengan baik, semoga kedepannya acara fkbmik bisa lebih seru dan asik		",Kegiatan telah berjalan dengan baik semoga kedepannya acara fkbmik bisa lebih seru dan asik,kegiatan telah berjalan dengan baik semoga kedepannya acara fkbmik bisa lebih seru dan asik,"['kegiatan', 'telah', 'berjalan', 'dengan', 'baik', 'semoga', 'kedepannya', 'acara', 'fkbmik', 'bisa', 'lebih', 'seru', 'dan', 'asik']","['acara', 'telah', 'terlaksana', 'dengan', 'baik', 'semoga', 'ke depannya', 'acara', 'fkbmik', 'bisa', 'lebih', 'seru', 'dan', 'asyik']","['acara', 'terlaksana', 'baik', 'semoga', 'ke depannya', 'acara', 'fkbmik', 'seru', 'asyik']",acara terlaksana baik semoga ke depannya acara fkbmik seru asyik,1,Kesuksesan Acara,Positif,,,,,,,
"Kegiatan terlaksana dengan baik		",Kegiatan terlaksana dengan baik,kegiatan terlaksana dengan baik,"['kegiatan', 'terlaksana', 'dengan', 'baik']","['acara', 'terlaksana', 'dengan', 'baik']","['acara', 'terlaksana', 'baik']",acara terlaksana baik,1,Kesuksesan Acara,Positif,,,,,,,
"kegiatan terlaksana dengan tertib dan baik		",kegiatan terlaksana dengan tertib dan baik,kegiatan terlaksana dengan tertib dan baik,"['kegiatan', 'terlaksana', 'dengan', 'tertib', 'dan', 'baik']","['acara', 'terlaksana', 'dengan', 'tertib', 'dan', 'baik']","['acara', 'terlaksana', 'tertib', 'baik']",acara terlaksana tertib baik,1,Kesuksesan Acara,Positif,,,,,,,
"Kegiatan yang berlangsung sudah berjalan dengan baik dan menarik		",Kegiatan yang berlangsung sudah berjalan dengan baik dan menarik,kegiatan yang berlangsung sudah berjalan dengan baik dan menarik,"['kegiatan', 'yang', 'berlangsung', 'sudah', 'berjalan', 'dengan', 'baik', 'dan', 'menarik']","['acara', 'yang', 'dilaksanakan', 'sudah', 'terlaksana', 'dengan', 'baik', 'dan', 'seru']","['acara', 'dilaksanakan', 'terlaksana', 'baik', 'seru']",acara dilaksanakan terlaksana baik seru,1,Kesuksesan Acara,Positif,,,,,,,
"Kegiatan yang bermanfaat, dan memberi dampak positif untuk masa depan		",Kegiatan yang bermanfaat dan memberi dampak positif untuk masa depan,kegiatan yang bermanfaat dan memberi dampak positif untuk masa depan,"['kegiatan', 'yang', 'bermanfaat', 'dan', 'memberi', 'dampak', 'positif', 'untuk', 'masa', 'depan']","['acara', 'yang', 'bermanfaat', 'dan', 'memberi', 'dampak', 'baik', 'untuk', 'masa', 'depan']","['acara', 'bermanfaat', 'memberi', 'dampak', 'baik', 'masa', 'depan']",acara bermanfaat memberi dampak baik masa depan,7,Manfaat dan Evaluasi,Positif,,,,,,,
"kegiatan yang sangat baik dalam mengatur waktu, tidak ada saran dan kritik yang spesifik karena acaranya berjalan ontime dan lancar		",kegiatan yang sangat baik dalam mengatur waktu tidak ada saran dan kritik yang spesifik karena acaranya berjalan ontime dan lancar,kegiatan yang sangat baik dalam mengatur waktu tidak ada saran dan kritik yang spesifik karena acaranya berjalan ontime dan lancar,"['kegiatan', 'yang', 'sangat', 'baik', 'dalam', 'mengatur', 'waktu', 'tidak', 'ada', 'saran', 'dan', 'kritik', 'yang', 'spesifik', 'karena', 'acaranya', 'berjalan', 'ontime', 'dan', 'lancar']","['acara', 'yang', 'sangat', 'baik', 'dalam', 'atur', 'waktu', 'tidak', 'ada', 'usulan', 'dan', 'kritik', 'yang', 'spesifik', 'karena', 'acara', 'terlaksana', 'tepat waktu', 'dan', 'sukses']","['acara', 'baik', 'atur', 'waktu', 'usulan', 'kritik', 'spesifik', 'acara', 'terlaksana', 'tepat waktu', 'sukses']",acara baik atur waktu usulan kritik spesifik acara terlaksana tepat waktu sukses,1,Kesuksesan Acara,Positif,,,,,,,
"Kegiatan yang sangat bermanfaat		",Kegiatan yang sangat bermanfaat,kegiatan yang sangat bermanfaat,"['kegiatan', 'yang', 'sangat', 'bermanfaat']","['acara', 'yang', 'sangat', 'bermanfaat']","['acara', 'bermanfaat']",acara bermanfaat,7,Manfaat dan Evaluasi,Positif,,,,,,,
"Kegiatan yang sangat bermanfaat dan menarik		",Kegiatan yang sangat bermanfaat dan menarik,kegiatan yang sangat bermanfaat dan menarik,"['kegiatan', 'yang', 'sangat', 'bermanfaat', 'dan', 'menarik']","['acara', 'yang', 'sangat', 'bermanfaat', 'dan', 'seru']","['acara', 'bermanfaat', 'seru']",acara bermanfaat seru,7,Manfaat dan Evaluasi,Positif,,,,,,,
"Kegiatan yang sangat bermanfaat semoga tahun depan ada diadakan lagi		",Kegiatan yang sangat bermanfaat semoga tahun depan ada diadakan lagi,kegiatan yang sangat bermanfaat semoga tahun depan ada diadakan lagi,"['kegiatan', 'yang', 'sangat', 'bermanfaat', 'semoga', 'tahun', 'depan', 'ada', 'diadakan', 'lagi']","['acara', 'yang', 'sangat', 'bermanfaat', 'semoga', 'waktu', 'depan', 'ada', 'mengadakan', 'lagi']","['acara', 'bermanfaat', 'semoga', 'waktu', 'depan', 'mengadakan']",acara bermanfaat semoga waktu depan mengadakan,7,Manfaat dan Evaluasi,Positif,,,,,,,
"kegiatan yang sangat bermanfaat, sangat memotivasi, pembicara juga sangat menarik		",kegiatan yang sangat bermanfaat sangat memotivasi pembicara juga sangat menarik,kegiatan yang sangat bermanfaat sangat memotivasi pembicara juga sangat menarik,"['kegiatan', 'yang', 'sangat', 'bermanfaat', 'sangat', 'memotivasi', 'pembicara', 'juga', 'sangat', 'menarik']","['acara', 'yang', 'sangat', 'bermanfaat', 'sangat', 'inspiratif', 'narasumber', 'juga', 'sangat', 'seru']","['acara', 'bermanfaat', 'inspiratif', 'narasumber', 'seru']",acara bermanfaat inspiratif narasumber seru,7,Manfaat dan Evaluasi,Positif,,,,,,,
"Kegiatannya bagus banget.		",Kegiatannya bagus banget,kegiatannya bagus banget,"['kegiatannya', 'bagus', 'banget']","['acara', 'keren', 'sekali']","['acara', 'keren', 'sekali']",acara keren sekali,1,Kesuksesan Acara,Positif,,,,,,,
"Kegiatannya berjalan dengan lancar dan baik		",Kegiatannya berjalan dengan lancar dan baik,kegiatannya berjalan dengan lancar dan baik,"['kegiatannya', 'berjalan', 'dengan', 'lancar', 'dan', 'baik']","['acara', 'terlaksana', 'dengan', 'sukses', 'dan', 'baik']","['acara', 'terlaksana', 'sukses', 'baik']",acara terlaksana sukses baik,1,Kesuksesan Acara,Positif,,,,,,,
"Kegiatannya cukup menarik dan tidak membosankan		",Kegiatannya cukup menarik dan tidak membosankan,kegiatannya cukup menarik dan tidak membosankan,"['kegiatannya', 'cukup', 'menarik', 'dan', 'tidak', 'membosankan']","['acara', 'cukup', 'seru', 'dan', 'tidak', 'bosan']","['acara', 'cukup', 'seru', 'bosan']",acara cukup seru bosan,1,Kesuksesan Acara,Positif,,,,,,,
"kegiatannya sangat berguna bagi maba fakultas ilmu komputer		",kegiatannya sangat berguna bagi maba fakultas ilmu komputer,kegiatannya sangat berguna bagi maba fakultas ilmu komputer,"['kegiatannya', 'sangat', 'berguna', 'bagi', 'maba', 'fakultas', 'ilmu', 'komputer']","['acara', 'sangat', 'bermanfaat', 'bagi', 'mahasiswa', 'fakultas', 'pengalaman', 'komputer']","['acara', 'bermanfaat', 'mahasiswa', 'fakultas', 'pengalaman', 'komputer']",acara bermanfaat mahasiswa fakultas pengalaman komputer,4,Antusiasme Peserta,Positif,,,,,,,
"Kegiatannya sangat bermanfaat		",Kegiatannya sangat bermanfaat,kegiatannya sangat bermanfaat,"['kegiatannya', 'sangat', 'bermanfaat']","['acara', 'sangat', 'bermanfaat']","['acara', 'bermanfaat']",acara bermanfaat,7,Manfaat dan Evaluasi,Positif,,,,,,,
"kegiatannya sangat bermanfaat dan seru, serta cocok sekali untuk anak millenials supaya tetap produktif		",kegiatannya sangat bermanfaat dan seru serta cocok sekali untuk anak millenials supaya tetap produktif,kegiatannya sangat bermanfaat dan seru serta cocok sekali untuk anak millenials supaya tetap produktif,"['kegiatannya', 'sangat', 'bermanfaat', 'dan', 'seru', 'serta', 'cocok', 'sekali', 'untuk', 'anak', 'millenials', 'supaya', 'tetap', 'produktif']","['acara', 'sangat', 'bermanfaat', 'dan', 'seru', 'serta', 'cocok', 'sekali', 'untuk', 'anak', 'milenial', 'supaya', 'tetap', 'produktif']","['acara', 'bermanfaat', 'seru', 'cocok', 'sekali', 'anak', 'milenial', 'tetap', 'produktif']",acara bermanfaat seru cocok sekali anak milenial tetap produktif,7,Manfaat dan Evaluasi,Positif,,,,,,,
"Kegiatannya sangat membantu dan seru		",Kegiatannya sangat membantu dan seru,kegiatannya sangat membantu dan seru,"['kegiatannya', 'sangat', 'membantu', 'dan', 'seru']","['acara', 'sangat', 'membantu', 'dan', 'seru']","['acara', 'membantu', 'seru']",acara membantu seru,7,Manfaat dan Evaluasi,Positif,,,,,,,
"Kegiatannya sangat menarik, para narasumber menyampaikan materinya dengan baik dan dapat di pahami		",Kegiatannya sangat menarik para narasumber menyampaikan materinya dengan baik dan dapat di pahami,kegiatannya sangat menarik para narasumber menyampaikan materinya dengan baik dan dapat di pahami,"['kegiatannya', 'sangat', 'menarik', 'para', 'narasumber', 'menyampaikan', 'materinya', 'dengan', 'baik', 'dan', 'dapat', 'di', 'pahami']","['acara', 'sangat', 'seru', 'para', 'narasumber', 'menyampaikan', 'materi', 'dengan', 'baik', 'dan', 'dapat', 'di', 'paham']","['acara', 'seru', 'narasumber', 'menyampaikan', 'materi', 'baik', 'paham']",acara seru narasumber menyampaikan materi baik paham,2,Materi dan Narasumber,Positif,,,,,,,
"kegiatannya sudah berjalan dengan baik sarannya tetap pertahankan		",kegiatannya sudah berjalan dengan baik sarannya tetap pertahankan,kegiatannya sudah berjalan dengan baik sarannya tetap pertahankan,"['kegiatannya', 'sudah', 'berjalan', 'dengan', 'baik', 'sarannya', 'tetap', 'pertahankan']","['acara', 'sudah', 'terlaksana', 'dengan', 'baik', 'usulan', 'tetap', 'pertahankan']","['acara', 'terlaksana', 'baik', 'usulan', 'tetap', 'pertahankan']",acara terlaksana baik usulan tetap pertahankan,1,Kesuksesan Acara,Positif,,,,,,,
"Kegiatannya sudah sangat bagus dan menarik		",Kegiatannya sudah sangat bagus dan menarik,kegiatannya sudah sangat bagus dan menarik,"['kegiatannya', 'sudah', 'sangat', 'bagus', 'dan', 'menarik']","['acara', 'sudah', 'sangat', 'keren', 'dan', 'seru']","['acara', 'keren', 'seru']",acara keren seru,1,Kesuksesan Acara,Positif,,,,,,,
"Keren banget sii webinar yang baru kali ini aku ikutin dimana pembicaranya sangat gaul dan asik tidak terlalu formal sehingga gen z sangat tertarik		",Keren banget sii webinar yang baru kali ini aku ikutin dimana pembicaranya sangat gaul dan asik tidak terlalu formal sehingga gen z sangat tertarik,keren banget sii webinar yang baru kali ini aku ikutin dimana pembicaranya sangat gaul dan asik tidak terlalu formal sehingga gen z sangat tertarik,"['keren', 'banget', 'sii', 'webinar', 'yang', 'baru', 'kali', 'ini', 'aku', 'ikutin', 'dimana', 'pembicaranya', 'sangat', 'gaul', 'dan', 'asik', 'tidak', 'terlalu', 'formal', 'sehingga', 'gen', 'z', 'sangat', 'tertarik']","['keren', 'sekali', 'sih', 'seminar', 'yang', 'inovatif', 'kali', 'ini', 'saya', 'ikut', 'di mana', 'narasumber', 'sangat', 'gaul', 'dan', 'asyik', 'tidak', 'terlalu', 'formal', 'sehingga', 'generasi', 'z', 'sangat', 'tertarik']","['keren', 'sekali', 'seminar', 'inovatif', 'kali', 'ikut', 'di mana', 'narasumber', 'gaul', 'asyik', 'terlalu', 'formal', 'generasi', 'z', 'tertarik']",keren sekali seminar inovatif kali ikut di mana narasumber gaul asyik terlalu formal generasi z tertarik,2,Materi dan Narasumber,Positif,,,,,,,
"Keren bangett acaranyaa, semangat semua panitia		",Keren bangett acaranyaa semangat semua panitia,keren bangett acaranyaa semangat semua panitia,"['keren', 'bangett', 'acaranyaa', 'semangat', 'semua', 'panitia']","['keren', 'banget', 'acara', 'semangat', 'semua', 'penyelenggara']","['keren', 'banget', 'acara', 'semangat', 'penyelenggara']",keren banget acara semangat penyelenggara,4,Antusiasme Peserta,Positif,,,,,,,
"Kerenn acaranya, isinya juga bagus.		",Kerenn acaranya isinya juga bagus,kerenn acaranya isinya juga bagus,"['kerenn', 'acaranya', 'isinya', 'juga', 'bagus']","['keren', 'acara', 'konten', 'juga', 'keren']","['keren', 'acara', 'konten', 'keren']",keren acara konten keren,1,Kesuksesan Acara,Positif,,,,,,,
"Kerenn semoga bisa lebih baik kedepannya		",Kerenn semoga bisa lebih baik kedepannya,kerenn semoga bisa lebih baik kedepannya,"['kerenn', 'semoga', 'bisa', 'lebih', 'baik', 'kedepannya']","['keren', 'semoga', 'bisa', 'lebih', 'baik', 'ke depannya']","['keren', 'semoga', 'baik', 'ke depannya']",keren semoga baik ke depannya,1,Kesuksesan Acara,Positif,,,,,,,
"Kerenn, sangat berguna untuk kami		",Kerenn sangat berguna untuk kami,kerenn sangat berguna untuk kami,"['kerenn', 'sangat', 'berguna', 'untuk', 'kami']","['keren', 'sangat', 'bermanfaat', 'untuk', 'kami']","['keren', 'bermanfaat']",keren bermanfaat,7,Manfaat dan Evaluasi,Positif,,,,,,,
"keseluruhan acara berlangsung sangat lancar		",keseluruhan acara berlangsung sangat lancar,keseluruhan acara berlangsung sangat lancar,"['keseluruhan', 'acara', 'berlangsung', 'sangat', 'lancar']","['seluruh', 'acara', 'dilaksanakan', 'sangat', 'sukses']","['seluruh', 'acara', 'dilaksanakan', 'sukses']",seluruh acara dilaksanakan sukses,1,Kesuksesan Acara,Positif,,,,,,,
"Keseluruhan sudah bagus, acaranya lancar, mcnya juga komunikatif sekali.		",Keseluruhan sudah bagus acaranya lancar mcnya juga komunikatif sekali,keseluruhan sudah bagus acaranya lancar mcnya juga komunikatif sekali,"['keseluruhan', 'sudah', 'bagus', 'acaranya', 'lancar', 'mcnya', 'juga', 'komunikatif', 'sekali']","['seluruh', 'sudah', 'keren', 'acara', 'sukses', 'mc', 'juga', 'komunikatif', 'sekali']","['seluruh', 'keren', 'acara', 'sukses', 'mc', 'komunikatif', 'sekali']",seluruh keren acara sukses mc komunikatif sekali,1,Kesuksesan Acara,Positif,,,,,,,
"kestabilan suara, terkadang putus - putus		",kestabilan suara terkadang putus putus,kestabilan suara terkadang putus putus,"['kestabilan', 'suara', 'terkadang', 'putus', 'putus']","['stabil', 'suara', 'terkadang', 'gangguan', 'gangguan']","['stabil', 'suara', 'terkadang', 'gangguan', 'gangguan']",stabil suara terkadang gangguan gangguan,5,Teknis dan Jaringan,Negatif,,,,,,,
"Ketepatan waktu pembicara		",Ketepatan waktu pembicara,ketepatan waktu pembicara,"['ketepatan', 'waktu', 'pembicara']","['ketepatan', 'waktu', 'narasumber']","['ketepatan', 'waktu', 'narasumber']",ketepatan waktu narasumber,6,Waktu dan Pelaksanaan Acara,Negatif,,,,,,,
"Kritik : tolong di perbaiki dan di cek dlu terkait masalah internet jaringan agar acara dpt berjalan lancar		",Kritik tolong di perbaiki dan di cek dlu terkait masalah internet jaringan agar acara dpt berjalan lancar,kritik tolong di perbaiki dan di cek dlu terkait masalah internet jaringan agar acara dpt berjalan lancar,"['kritik', 'tolong', 'di', 'perbaiki', 'dan', 'di', 'cek', 'dlu', 'terkait', 'masalah', 'internet', 'jaringan', 'agar', 'acara', 'dpt', 'berjalan', 'lancar']","['kritik', 'tolong', 'di', 'perbaiki', 'dan', 'di', 'memeriksa', 'dulu', 'relevan', 'kendala', 'internet', 'jaringan', 'agar', 'acara', 'dapat', 'terlaksana', 'sukses']","['kritik', 'perbaiki', 'memeriksa', 'dulu', 'relevan', 'kendala', 'internet', 'jaringan', 'acara', 'terlaksana', 'sukses']",kritik perbaiki memeriksa dulu relevan kendala internet jaringan acara terlaksana sukses,5,Teknis dan Jaringan,Negatif,,,,,,,
"Saran : lebih memperhatikan secara penuh terhadap acara agar tidak ada delay saat pemindahan materi kepada moderator		",Saran lebih memperhatikan secara penuh terhadap acara agar tidak ada delay saat pemindahan materi kepada moderator,saran lebih memperhatikan secara penuh terhadap acara agar tidak ada delay saat pemindahan materi kepada moderator,"['saran', 'lebih', 'memperhatikan', 'secara', 'penuh', 'terhadap', 'acara', 'agar', 'tidak', 'ada', 'delay', 'saat', 'pemindahan', 'materi', 'kepada', 'moderator']","['usulan', 'lebih', 'perhatikan', 'secara', 'penuh', 'terhadap', 'acara', 'agar', 'tidak', 'ada', 'terlambat', 'saat', 'pemindahan', 'materi', 'kepada', 'moderator']","['usulan', 'perhatikan', 'penuh', 'acara', 'terlambat', 'pemindahan', 'materi', 'moderator']",usulan perhatikan penuh acara terlambat pemindahan materi moderator,6,Waktu dan Pelaksanaan Acara,Negatif,,,,,,,
"Kritik dan sarannya gak ada, karena menurut saya udah bagus. Terima kasih sudah mengadakan acara ini kak		",Kritik dan sarannya gak ada karena menurut saya udah bagus Terima kasih sudah mengadakan acara ini kak,kritik dan sarannya gak ada karena menurut saya udah bagus terima kasih sudah mengadakan acara ini kak,"['kritik', 'dan', 'sarannya', 'gak', 'ada', 'karena', 'menurut', 'saya', 'udah', 'bagus', 'terima', 'kasih', 'sudah', 'mengadakan', 'acara', 'ini', 'kak']","['kritik', 'dan', 'usulan', 'tidak', 'ada', 'karena', 'menurut', 'saya', 'sudah', 'keren', 'terima', 'kasih', 'sudah', 'mengadakan', 'acara', 'ini', 'kakak']","['kritik', 'usulan', 'keren', 'terima', 'kasih', 'mengadakan', 'acara', 'kakak']",kritik usulan keren terima kasih mengadakan acara kakak,7,Manfaat dan Evaluasi,Positif,,,,,,,
"kritik tidak ada namun saran saya acara agar lebih aktif dalam berkomunikasi dengan peserta agar peserta tidak bosan dalam mengikuti acara sampai selesai		",kritik tidak ada namun saran saya acara agar lebih aktif dalam berkomunikasi dengan peserta agar peserta tidak bosan dalam mengikuti acara sampai selesai,kritik tidak ada namun saran saya acara agar lebih aktif dalam berkomunikasi dengan peserta agar peserta tidak bosan dalam mengikuti acara sampai selesai,"['kritik', 'tidak', 'ada', 'namun', 'saran', 'saya', 'acara', 'agar', 'lebih', 'aktif', 'dalam', 'berkomunikasi', 'dengan', 'peserta', 'agar', 'peserta', 'tidak', 'bosan', 'dalam', 'mengikuti', 'acara', 'sampai', 'selesai']","['kritik', 'tidak', 'ada', 'namun', 'usulan', 'saya', 'acara', 'agar', 'lebih', 'aktif', 'dalam', 'interaksi', 'dengan', 'peserta', 'agar', 'peserta', 'tidak', 'bosan', 'dalam', 'ikut', 'acara', 'sampai', 'selesai']","['kritik', 'usulan', 'acara', 'aktif', 'interaksi', 'peserta', 'peserta', 'bosan', 'ikut', 'acara', 'selesai']",kritik usulan acara aktif interaksi peserta peserta bosan ikut acara selesai,7,Manfaat dan Evaluasi,Positif,,,,,,,
"kritiknya semoga lebih tepat waktu dan diadakan game atau interaksi yang menarik		",kritiknya semoga lebih tepat waktu dan diadakan game atau interaksi yang menarik,kritiknya semoga lebih tepat waktu dan diadakan game atau interaksi yang menarik,"['kritiknya', 'semoga', 'lebih', 'tepat', 'waktu', 'dan', 'diadakan', 'game', 'atau', 'interaksi', 'yang', 'menarik']","['kritik', 'semoga', 'lebih', 'tepat', 'waktu', 'dan', 'mengadakan', 'permainan', 'atau', 'interaksi', 'yang', 'seru']","['kritik', 'semoga', 'tepat', 'waktu', 'mengadakan', 'permainan', 'interaksi', 'seru']",kritik semoga tepat waktu mengadakan permainan interaksi seru,3,Harapan Acara,Negatif,,,,,,,
"kualitas audio dan video agak kurang		",kualitas audio dan video agak kurang,kualitas audio dan video agak kurang,"['kualitas', 'audio', 'dan', 'video', 'agak', 'kurang']","['kualitas', 'audio', 'dan', 'konten', 'agak', 'kurang']","['kualitas', 'audio', 'konten']",kualitas audio konten,5,Teknis dan Jaringan,Negatif,,,,,,,
"Kualitas zoom ditingkatkan		",Kualitas zoom ditingkatkan,kualitas zoom ditingkatkan,"['kualitas', 'zoom', 'ditingkatkan']","['kualitas', 'zoom', 'ditingkatkan']","['kualitas', 'zoom', 'ditingkatkan']",kualitas zoom ditingkatkan,5,Teknis dan Jaringan,Negatif,,,,,,,
"lebih baik mulai acara saat pagi hari agar peserta tidak mengantuk		",lebih baik mulai acara saat pagi hari agar peserta tidak mengantuk,lebih baik mulai acara saat pagi hari agar peserta tidak mengantuk,"['lebih', 'baik', 'mulai', 'acara', 'saat', 'pagi', 'hari', 'agar', 'peserta', 'tidak', 'mengantuk']","['lebih', 'baik', 'mulai', 'acara', 'saat', 'waktu', 'hari', 'agar', 'peserta', 'tidak', 'mengantuk']","['baik', 'mulai', 'acara', 'waktu', 'hari', 'peserta', 'mengantuk']",baik mulai acara waktu hari peserta mengantuk,6,Waktu dan Pelaksanaan Acara,Positif,,,,,,,
"Lebih ditingkatkan dari segi teknis		",Lebih ditingkatkan dari segi teknis,lebih ditingkatkan dari segi teknis,"['lebih', 'ditingkatkan', 'dari', 'segi', 'teknis']","['lebih', 'ditingkatkan', 'dari', 'segi', 'teknis']","['ditingkatkan', 'segi', 'teknis']",ditingkatkan segi teknis,5,Teknis dan Jaringan,Positif,,,,,,,
"Masih ditemukan suara patah-patah saat pemaparan materi, karena masih adanya buffering Internet.		",Masih ditemukan suara patahpatah saat pemaparan materi karena masih adanya buffering Internet,masih ditemukan suara patahpatah saat pemaparan materi karena masih adanya buffering internet,"['masih', 'ditemukan', 'suara', 'patahpatah', 'saat', 'pemaparan', 'materi', 'karena', 'masih', 'adanya', 'buffering', 'internet']","['masih', 'ditemukan', 'suara', 'gangguan', 'saat', 'pemaparan', 'materi', 'karena', 'masih', 'ada', 'bufering', 'internet']","['ditemukan', 'suara', 'gangguan', 'pemaparan', 'materi', 'bufering', 'internet']",ditemukan suara gangguan pemaparan materi bufering internet,5,Teknis dan Jaringan,Negatif,,,,,,,
"Masih terjadi lag di beberapa pembicara		",Masih terjadi lag di beberapa pembicara,masih terjadi lag di beberapa pembicara,"['masih', 'terjadi', 'lag', 'di', 'beberapa', 'pembicara']","['masih', 'berlangsung', 'gangguan', 'di', 'beberapa', 'narasumber']","['berlangsung', 'gangguan', 'beberapa', 'narasumber']",berlangsung gangguan beberapa narasumber,5,Teknis dan Jaringan,Negatif,,,,,,,
"Materi yang diberi sangat bermanfaat sekali		",Materi yang diberi sangat bermanfaat sekali,materi yang diberi sangat bermanfaat sekali,"['materi', 'yang', 'diberi', 'sangat', 'bermanfaat', 'sekali']","['materi', 'yang', 'diberikan', 'sangat', 'bermanfaat', 'sekali']","['materi', 'diberikan', 'bermanfaat', 'sekali']",materi diberikan bermanfaat sekali,2,Materi dan Narasumber,Positif,,,,,,,
"materi yang diberikan sangat menarik		",materi yang diberikan sangat menarik,materi yang diberikan sangat menarik,"['materi', 'yang', 'diberikan', 'sangat', 'menarik']","['materi', 'yang', 'diberikan', 'sangat', 'seru']","['materi', 'diberikan', 'seru']",materi diberikan seru,2,Materi dan Narasumber,Positif,,,,,,,
